DATE,SESSION,TYPE_START,FROM,TO,LOCATION,SESSION_NUM,TYPE,TOPIC,CHAIR,CHAIR_CL,CHAIR_CONFIRMED,SPEAKER,TITLE,ABSTRACT,ABSTRACT_CL,REFERENCES,SPEAKER1,SPEAKER2,AFF1,AFF2,AUTHORS,TOPIC_REASSIGNED
8/1/2023,E,1:30 PM,2:30 PM,3:00 PM,Aliber 107,4,Parallel Session,Life Insurance,Junsen Tang,Junsen Tang,TRUE,Junsen Tang,On the Actuarial Fairness and Marketability of Reverse Mortgages With Tenure Payment Option: The Optimal Surrender Policy Perspective,"This study conducts an optimal surrender analysis of reverse mortgage (RM) loans offered to elderly homeowners as a financing option. Recent market evidence on borrower early surrenders has raised concerns about the marketability of RM products and their impact on the program viability. In this paper, we derive the borrower optimal surrender strategy as a function of the underlying value of the home used as collateral for RM contracts with tenure payment option. Using a probabilistic approach to American option pricing, we present a decomposition result for the value of the contract as the sum of its European counterpart without the surrendering provision and an early exercise premium. By means of the resulting surrender boundary and reference probabilities, we explain the existing market evidence about borrower rational lapse and propose an asset–liability matching rule for valuation fairness and marketability of the prevalent RM programs.","This study conducts an optimal surrender analysis of reverse mortgage (RM) loans offered to elderly homeowners as a financing option. Recent market evidence on borrower early surrenders has raised concerns about the marketability of RM products and their impact on the program viability. In this paper, we derive the borrower optimal surrender strategy as a function of the underlying value of the home used as collateral for RM contracts with tenure payment option. Using a probabilistic approach to American option pricing, we present a decomposition result for the value of the contract as the sum of its European counterpart without the surrendering provision and an early exercise premium. By means of the resulting surrender boundary and reference probabilities, we explain the existing market evidence about borrower rational lapse and propose an asset–liability matching rule for valuation fairness and marketability of the prevalent RM programs.", ,Junsen Tang, ,University of Saint Thomas,,,Life Insurance
8/1/2023,E,1:30 PM,1:30 PM,2:00 PM,Aliber 108,5,Parallel Session,Catastrophic Risk Modeling,Fan Yang,Fan Yang,TRUE,Vajira Manathunga,Pandemic Bonds and Stochastic Logistic Growth Model,"Pandemic bonds can be used as an effective tool to mitigate economic losses governments confronts during pandemic and transfer it to global capital market. Once considered ``uninsurable,"" pandemic bonds came to world attention with the World Bank pandemic bonds issuance in 2017. Compared to other CAT bonds, pandemic bonds received less attention from actuaries, industry professionals and academic researchers. Existing research mostly focused on how to bring epidemiological parameters to the pricing mechanism through compartmental models. In this research, we introduce stochastic logistic growth model based pandemic bond pricing framework. We demonstrate proposed model by calibrating it using COVID-19 data and pricing zero coupon bond. The model can be used as an alternative to epidemic compartmental model based pandemic bond pricing mechanisms.","Pandemic bonds can be used as an effective tool to mitigate economic losses governments confronts during pandemic and transfer it to global capital market. Once considered ``uninsurable,"" pandemic bonds came to world attention with the World Bank pandemic bonds issuance in 2017. Compared to other CAT bonds, pandemic bonds received less attention from actuaries, industry professionals and academic researchers. Existing research mostly focused on how to bring epidemiological parameters to the pricing mechanism through compartmental models. In this research, we introduce stochastic logistic growth model based pandemic bond pricing framework. We demonstrate proposed model by calibrating it using COVID-19 data and pricing zero coupon bond. The model can be used as an alternative to epidemic compartmental model based pandemic bond pricing mechanisms.",,Vajira Manathunga, ,Middle Tennessee State University,,,Catastrophic risk modeling
8/1/2023,E,1:30 PM,2:00 PM,2:30 PM,Aliber 108,5,Parallel Session,Catastrophic Risk Modeling,Fan Yang,Fan Yang,TRUE,Natalia Humphreys,Exceedance Probability in Catastrophe Modeling,"In this presentation we explore two of the most important notions in Catastrophe Modeling: the Occurrence Exceedance Probability (OEP) and the Aggregate Exceedance Probability (AEP) curves.  Construction of each curve is discussed and comparisons are made.   Several numerical and theoretical examples demonstrate introduced metrics and techniques.   A separate discussion is dedicated to a connection between the distribution of loss severities and the OEP depending on the distribution of claim counts.  The presentation is concluded with demonstration of OEP and AEP curves for the deadliest, costliest, and most intense US tropical cyclones based on the 2011 National Oceanic and Atmospheric Administration (NOAA) report.","In this presentation we explore two of the most important notions in Catastrophe Modeling: the Occurrence Exceedance Probability (OEP) and the Aggregate Exceedance Probability (AEP) curves. Construction of each curve is discussed and comparisons are made. Several numerical and theoretical examples demonstrate introduced metrics and techniques. A separate discussion is dedicated to a connection between the distribution of loss severities and the OEP depending on the distribution of claim counts. The presentation is concluded with demonstration of OEP and AEP curves for the deadliest, costliest, and most intense US tropical cyclones based on the 2011 National Oceanic and Atmospheric Administration (NOAA) report.",,Natalia Humphreys, ,University of Texas at Dallas,,,Catastrophic risk modeling
8/1/2023,E,1:30 PM,2:30 PM,3:00 PM,Aliber 108,5,Parallel Session,Catastrophic Risk Modeling,Fan Yang,Fan Yang,TRUE,Fan Yang,Catastrophe Risk Pooling,"The ongoing climate change causes natural disaster losses are on the rise. The huge gap between actual and insured losses, however, is growing. Insurance-based solutions are receiving increasing attention to mitigate disaster and climate risks. Due to the features of catastrophic risks, catastrophe insurance market has failed to provide sufficient protections. In this paper we discuss how pooling catastrophe risks from various geographies and perils can be an effective tool for diversifying catastrophic risks and reducing risk premiums. Simulations and real data analysis are provided to illustrate our results.","The ongoing climate change causes natural disaster losses are on the rise. The huge gap between actual and insured losses, however, is growing. Insurance-based solutions are receiving increasing attention to mitigate disaster and climate risks. Due to the features of catastrophic risks, catastrophe insurance market has failed to provide sufficient protections. In this paper we discuss how pooling catastrophe risks from various geographies and perils can be an effective tool for diversifying catastrophic risks and reducing risk premiums. Simulations and real data analysis are provided to illustrate our results.",,Fan Yang, ,University of Waterloo,,,Catastrophic risk modeling
8/1/2023,F,3:00 PM,3:00 PM,3:20 PM,Aliber Hall,NA,Coffee Break,NA,NA,NA,NA,NA,NA,NA,NA,NA,NA,NA,NA,NA,NA,NA
8/1/2023,F,3:20 PM,3:20 PM,3:50 PM,Aliber 101,1,Parallel Session,"(Invited Session) Education Updates from CIA, CAS, and SOA",Stuart Klugman,Stuart Klugman,TRUE,Alicia Rollo,New Options and Opportunities in the CIA Education System," Learn how the Canadian Institute of Actuaries is transforming actuarial education and the qualification process in Canada to provide innovative, flexible, and accessible options for all candidates. Through an expansion of our 10+ year university accreditation program across 11 accredited universities, and a new suite of modern educational products leading to qualification as ACIA or FCIA, the future of actuarial qualification in Canada is bright!","Learn how the Canadian Institute of Actuaries is transforming actuarial education and the qualification process in Canada to provide innovative, flexible, and accessible options for all candidates. Through an expansion of our 10+ year university accreditation program across 11 accredited universities, and a new suite of modern educational products leading to qualification as ACIA or FCIA, the future of actuarial qualification in Canada is bright!", ,Alicia Rollo, ,Canadian Institute of Actuaries, , ," Education Updates from CIA, CAS, and SOA"
8/1/2023,F,3:20 PM,3:50 PM,4:20 PM,Aliber 101,1,Parallel Session,"(Invited Session) Education Updates from CIA, CAS, and SOA",Stuart Klugman,Stuart Klugman,TRUE,Ken Williams and Alisa Walch ,CAS Resources To Help Prepare Your Students To Be the Next Generation of Property/Casualty Actuaries," Looking to learn about the exciting new updates and resources being offered by the Casualty Actuarial Society? Attend this session that will cover the recent changes to the CAS credentialing pathway, as well as resources offered to students and academics to gain more exposure to the property and casualty insurance industry. Additional highlights include student opportunities like the CAS Student Central Summer Program and the various off-the-shelf resources for academics such as CAS case studies and competition toolkits.  CAS staff and volunteers who work first-hand on these various initiatives will answer your questions and hear your feedback throughout the session!","Looking to learn about the exciting new updates and resources being offered by the Casualty Actuarial Society? Attend this session that will cover the recent changes to the CAS credentialing pathway, as well as resources offered to students and academics to gain more exposure to the property and casualty insurance industry. Additional highlights include student opportunities like the CAS Student Central Summer Program and the various off-the-shelf resources for academics such as CAS case studies and competition toolkits. CAS staff and volunteers who work first-hand on these various initiatives will answer your questions and hear your feedback throughout the session!", ,Ken Williams,Alisa Walch ,Casualty Actuarial Society,Casualty Actuarial Society, ," Education Updates from CIA, CAS, and SOA"
8/1/2023,F,3:20 PM,4:20 PM,4:50 PM,Aliber 101,1,Parallel Session,"(Invited Session) Education Updates from CIA, CAS, and SOA",Stuart Klugman,Stuart Klugman,TRUE,Stuart Klugman,SOA Education Updates, This annual update will provide a review of SOA education and examination over the past year and provide a preview of upcoming changes. There will be time for attendees to ask questions.,This annual update will provide a review of SOA education and examination over the past year and provide a preview of upcoming changes. There will be time for attendees to ask questions., ,Stuart Klugman, ,Society of Actuaries, , ," Education Updates from CIA, CAS, and SOA"
8/1/2023,F,3:20 PM,3:20 PM,3:50 PM,Aliber 102,2,Parallel Session,Statistical and Machine Learning III,Hong Li,Hong Li,FALSE,Chengguo Weng,Two-Phase Selection of Representative Contracts for Valuation of Large Variable Annuity Portfolios," A computationally appealing methodology for the valuation of large variable annuities portfolios is a metamodelling framework that evaluates a small set of representative contracts, fits a predictive model based on these computed values, and then extrapolates the model to estimate the values of the remaining contracts. This paper proposes a new two-phase procedure for selecting representative contracts. The representatives from the first phase are determined using contract attributes as in existing metamodelling approaches, but those in the second phase are chosen by utilizing the information contained in the values of the representatives from the first phase. Two numerical studies confirm that our two-phase selection procedure improves upon conventional approaches from the existing literature.","A computationally appealing methodology for the valuation of large variable annuities portfolios is a metamodelling framework that evaluates a small set of representative contracts, fits a predictive model based on these computed values, and then extrapolates the model to estimate the values of the remaining contracts. This paper proposes a new two-phase procedure for selecting representative contracts. The representatives from the first phase are determined using contract attributes as in existing metamodelling approaches, but those in the second phase are chosen by utilizing the information contained in the values of the representatives from the first phase. Two numerical studies confirm that our two-phase selection procedure improves upon conventional approaches from the existing literature.", ,Chengguo Weng, ,University of Waterloo,,,Statistical and machine learning III
8/1/2023,F,3:20 PM,3:50 PM,4:20 PM,Aliber 102,2,Parallel Session,Statistical and Machine Learning III,Hong Li,Hong Li,FALSE,Wenjun Zhu,Machine Learning in Long-Term Mortality Forecasting," We propose a new machine learning-based framework for long-term mortality forecasting. Based on ideas of neighbouring prediction, model ensembling, and tree boosting, this framework can significantly improve the prediction accuracy of long-term mortality. In addition, the proposed framework addresses the challenge of a shrinking pattern in long-term forecasting with information from neighbouring ages and cohorts. An extensive empirical analysis is conducted using various countries and regions in the Human Mortality Database. Results show that this framework reduces the mean absolute percentage error (MAPE) of the 20-year forecasting by almost 50% compared to classic stochastic mortality models, and it also outperforms deep learning-based benchmarks. Moreover, including mortality data from multiple populations can further enhance the long-term prediction performance of this framework.  ","We propose a new machine learning-based framework for long-term mortality forecasting. Based on ideas of neighbouring prediction, model ensembling, and tree boosting, this framework can significantly improve the prediction accuracy of long-term mortality. In addition, the proposed framework addresses the challenge of a shrinking pattern in long-term forecasting with information from neighbouring ages and cohorts. An extensive empirical analysis is conducted using various countries and regions in the Human Mortality Database. Results show that this framework reduces the mean absolute percentage error (MAPE) of the 20-year forecasting by almost 50% compared to classic stochastic mortality models, and it also outperforms deep learning-based benchmarks. Moreover, including mortality data from multiple populations can further enhance the long-term prediction performance of this framework.", ,Wenjun Zhu, ,Nanyang Technological University,,,Statistical and machine learning II
8/1/2023,F,3:20 PM,4:20 PM,4:50 PM,Aliber 102,2,Parallel Session,Statistical and Machine Learning III,Hong Li,Hong Li,FALSE,Hong Li,Pricing Catastrophe Bonds—A Probabilistic Machine Learning Approach,"This paper applies a probabilistic machine learning method to price catastrophe bonds in the primary market. The proposed method combines gradient boosting with conformal predictions and is compared to traditional methods such as linear regression. Using all CAT bonds issued between January 1999 and March 2021, the proposed method is found to be more robust and yields more accurate predictions of the bond spreads. Reasonable confidence intervals are generated by the proposed machine learning method. Additionally, the machine learning methods identify nonlinear relationships between risk factors and bond spreads, suggesting that linear regression could mis-estimate the bond spreads. Overall, this paper demonstrates the potential of machine learning methods in improving the pricing of catastrophe bonds in the primary market.","This paper applies a probabilistic machine learning method to price catastrophe bonds in the primary market. The proposed method combines gradient boosting with conformal predictions and is compared to traditional methods such as linear regression. Using all CAT bonds issued between January 1999 and March 2021, the proposed method is found to be more robust and yields more accurate predictions of the bond spreads. Reasonable confidence intervals are generated by the proposed machine learning method. Additionally, the machine learning methods identify nonlinear relationships between risk factors and bond spreads, suggesting that linear regression could mis-estimate the bond spreads. Overall, this paper demonstrates the potential of machine learning methods in improving the pricing of catastrophe bonds in the primary market.", ,Hong Li, ,University of Guelph,,,Statistical and machine learning II
8/1/2023,F,3:20 PM,3:20 PM,3:50 PM,Aliber 103,3,Parallel Session,Cyber Risk,Maochao Xu,Maochao Xu,TRUE,Xingyun (Claire) Tan,Analysing Reporting Patterns and Frequency of Data Breaches Published by State Attorneys General in the United States,"We study data breach claim notifications and investigates claim frequency by state and severity of the breach in the United States. We identify how breaches are notified over time, and discuss how to project breaches that have incurred but have not been reported yet. We utilise a novel set of public data provided by state Attorneys General that contains dates of occurrence and recent breaches, which are not included in the most widely used public dataset provided by the Privacy Rights Clearinghouse. We introduce this novel data set and compare it with the PRC dataset for cyber researchers to understand their disparities and better use these resources to obtain cyber insurance insights. We implement a new event definition that provides insight into the true impact of data breaches and allows for managing cyber insurance at portfolio level. Our analysis provides important insights. The reporting patterns vary significantly across different time periods and breach sizes, and the average delay between occurrence and reporting has increased across states. The data breach frequency is relatively stable before 2020 but increases subsequently across states. Although the reporting patterns vary across states, states are strongly positively correlated in terms of frequency trends, growth rates, the timing of change in reporting patterns, and trends in the average delay.","We study data breach claim notifications and investigates claim frequency by state and severity of the breach in the United States. We identify how breaches are notified over time, and discuss how to project breaches that have incurred but have not been reported yet. We utilise a novel set of public data provided by state Attorneys General that contains dates of occurrence and recent breaches, which are not included in the most widely used public dataset provided by the Privacy Rights Clearinghouse. We introduce this novel data set and compare it with the PRC dataset for cyber researchers to understand their disparities and better use these resources to obtain cyber insurance insights. We implement a new event definition that provides insight into the true impact of data breaches and allows for managing cyber insurance at portfolio level. Our analysis provides important insights. The reporting patterns vary significantly across different time periods and breach sizes, and the average delay between occurrence and reporting has increased across states. The data breach frequency is relatively stable before 2020 but increases subsequently across states. Although the reporting patterns vary across states, states are strongly positively correlated in terms of frequency trends, growth rates, the timing of change in reporting patterns, and trends in the average delay.",,Xingyun (Claire) Tan, ,University of Melbourne,,,Cyber Risk
8/1/2023,F,3:20 PM,3:50 PM,4:20 PM,Aliber 103,3,Parallel Session,Cyber Risk,Maochao Xu,Maochao Xu,TRUE,Changyue Hu,NLP-Powered Repository and Search Engine for Academic Papers: A Case Study on Cyber Risk Literature With CyLit,"As the body of academic literature continues to grow, researchers face increasing difficulties in effectively searching for relevant resources. Existing databases and search engines often fall short of providing a comprehensive and contextually relevant collection of academic literature. To address this issue, we propose a novel framework that leverages Natural Language Processing (NLP) techniques. This framework automates the retrieval, summarization, and classification of academic literature within a specific research domain. To demonstrate the effectiveness of our approach, we introduce CyLit, an NLP-powered repository specifically designed for the cyber risk literature. CyLit empowers researchers by providing access to context-specific resources and enabling the tracking of trends in the dynamic and rapidly evolving field of cyber risk. Through the automatic processing of large volumes of data, our NLP-powered solution significantly enhances the efficiency and specificity of academic literature searches. By utilizing NLP techniques, we aim to revolutionize the way researchers discover, analyze, and utilize academic resources, ultimately fostering advancements in various domains of knowledge.","As the body of academic literature continues to grow, researchers face increasing difficulties in effectively searching for relevant resources. Existing databases and search engines often fall short of providing a comprehensive and contextually relevant collection of academic literature. To address this issue, we propose a novel framework that leverages Natural Language Processing (NLP) techniques. This framework automates the retrieval, summarization, and classification of academic literature within a specific research domain. To demonstrate the effectiveness of our approach, we introduce CyLit, an NLP-powered repository specifically designed for the cyber risk literature. CyLit empowers researchers by providing access to context-specific resources and enabling the tracking of trends in the dynamic and rapidly evolving field of cyber risk. Through the automatic processing of large volumes of data, our NLP-powered solution significantly enhances the efficiency and specificity of academic literature searches. By utilizing NLP techniques, we aim to revolutionize the way researchers discover, analyze, and utilize academic resources, ultimately fostering advancements in various domains of knowledge.",,Changyue Hu, ,University of Illinois Urbana-Champaign,,,Cyber Risk
8/1/2023,F,3:20 PM,4:20 PM,4:50 PM,Aliber 103,3,Parallel Session,Cyber Risk,Maochao Xu,Maochao Xu,TRUE,Maochao Xu,EBiCop: Ensemble Bivariate Copulas for Modeling Multivariate Cyber Data Breach Risks With Insurance Applications,"Modeling the multivariate dependence among cyber data breach risks presents a significant challenge due to the sparsity and heavy tail properties exhibited by breach events. In this study, we propose a novel ensemble learning approach that effectively captures both the temporal and cross-sectional dependence inherent in cyber risks. Our approach leverages bivariate copulas to generate predictive members, and the resulting predictive distribution is carefully calibrated by minimizing the distribution score. Moreover, we demonstrate the applicability of our proposed model in the domain of insurance pricing. Through extensive simulations and analysis of real-world data, our findings reveal that our approach outperforms existing methodologies reported in the literature. The superior performance of our approach highlights its potential to enhance risk assessment and insurance pricing practices related to cyber data breaches.","Modeling the multivariate dependence among cyber data breach risks presents a significant challenge due to the sparsity and heavy tail properties exhibited by breach events. In this study, we propose a novel ensemble learning approach that effectively captures both the temporal and cross-sectional dependence inherent in cyber risks. Our approach leverages bivariate copulas to generate predictive members, and the resulting predictive distribution is carefully calibrated by minimizing the distribution score. Moreover, we demonstrate the applicability of our proposed model in the domain of insurance pricing. Through extensive simulations and analysis of real-world data, our findings reveal that our approach outperforms existing methodologies reported in the literature. The superior performance of our approach highlights its potential to enhance risk assessment and insurance pricing practices related to cyber data breaches.",,Maochao Xu, ,Illinois State University,,,Cyber Risk
